7773,MezzaCorona Cabernet Sauvignon 2017
7774,Bongiovanni Barolo Pernanno 2012
7775,Bongiovanni Barolo Pernanno 2011
7776,Downes Family Vineyards Sanctuary Peak Sauvignon Blanc 2014
7777,Zephyr Sauvignon Blanc 2017
7778,Salvatore Molettieri Taurasi Vigna Cinque Querce 2008
7779,Castello di Bolgheri Bolgheri Varvara 2017
7780,Mauro Molino Gallinotto Barolo 2015
7781,Trinity Hill Gimblett Gravels Syrah 2015
7782,Cirillo The Vincent Grenache 2015
7783,Trinity Hill Gimblett Gravels The Gimblett 2014
7784,Clos Henri Pinot Noir 2015
7785,Paul Hobbs Beckstoffer To Kalon Vineyard Cabernet Sauvignon 2015
7786,Enrique Mendoza Las Quebradas Monastrell 2014
7787,Conde de Hervias Trinidad 2013
7788,Enrique Mendoza Estrecho Monastrell 2012
7789,Chanin Santa Barbara Pinot Noir 2016
7790,Far Niente Chardonnay 2017
7791,Meiomi Sparkling
7792,Gaja Conteisa 2014
7793,Alpha Estate Hedgehog Vineyard Xinomavro 2015
7794,Rochioli Estate Chardonnay 2016
7795,Alpha Estate Hedgehog Vineyard Xinomavro 2016
7796,Domaine Vincent & Sophie Morey Bourgogne Chardonnay 2017
7797,Chateau Lassegue 2010
7798,Green & Red Catacula Vineyard Sauvignon Blanc 2014
7799,Masi Costasera Amarone Classico Riserva 2012
7800,Brick House Cascadia Chardonnay 2015
7801,Evening Land Seven Springs Vineyard Chardonnay 2016
7802,Ziata Sauvignon Blanc 2017
7803,Hilliard Bruce Earth Pinot Noir 2013
7804,Losada El Pajaro Rojo Mencia 2014
7805,Bodegas Ateca Atteca 2016
7807,Gandona Winery Cabernet Sauvignon 2015
7808,Hess Select Pinot Noir 2016
7809,Donati Family Vineyards Sisters Forever Un-Oaked Chardonnay 2017
7810,Firestone Merlot 2012
7811,Hogue Genesis Syrah 2012
7812,Ramey Sidebar Ritchie Vineyard Sauvignon Blanc 2016
7813,Monteverro Terra di Monteverro 2012
7814,Domaine Des Enfants L'Enfant Perdu 2014
7815,St. Francis Merlot 2016
7816,Bedrock Wine Company Montecillo Vineyard Cabernet Sauvignon 2017
7817,Jean-Luc Colombo La Dame Du Rouet Rose 2017
7818,Hogue Pinot Grigio 2014
7819,Amapola Creek Cuvee Alis 2012
7820,Hanzell Chardonnay 2014
7821,Cline Ancient Vines Carignane 2016
7822,Owen Roe Rosa Mystica Cabernet Franc 2016
7824,Kunde Chardonnay 2017
7825,Highway 12 Cabernet Sauvignon 2016
7826,Domaines Bunan Le Petit Rouviere 2018
7827,Kunde Estate Zinfandel 2015
7828,Owen Roe DuBrul Vineyard Cabernet Sauvignon 2013
7829,Bucklin Old Hill Ranch Bambino Zinfandel 2016
7830,B.R. Cohn Olive Hill Estate Cabernet Sauvignon 2016
7831,Mercer Estates Sauvignon Blanc 2015
7832,Kunde Magnolia Lane Sauvignon Blanc 2018
7833,Owen Roe Yakima Red Blend 2016
7834,14 Hands Brut Rose
7835,Robert Craig Cellars Durell Vineyard Chardonnay 2012
7836,Schug Sonoma Valley Cabernet Sauvignon 2016
7837,Westwood Winery Annadel Gap Vineyard Estate Pinot Noir 2016
7839,Highway 12 Sauvignon Blanc 2016
7840,Bucklin Old Hill Ranch Cabernet Sauvignon 2016
7841,Mas de Gourgonnier Les Baux de Provence Rouge 2016
7842,Highway 12 Sauvignon Blanc 2015
7843,Eponymous Macallister Red Blend 2012
7844,Gundlach Bundschu Merlot 2015
7845,Louis Latour Domaine de Valmoissine Pinot Noir 2016
7846,Cline Big Break Zinfandel 2014
7847,Quilceda Creek Cabernet Sauvignon 2016
7848,Failla Haynes Vineyard Chardonnay 2017
7849,Berlucchi Franciacorta Rose
7850,Terlato Family Vineyards Friuli Pinot Grigio 2017
7851,Bucci Verdicchio Classico dei Castelli di Jesi 2016
7852,Melsheimer Riesling Handwerk 2016
7853,Koehler-Ruprecht Weisser Burgunder Kabinett Trocken 2017
7854,Pala i Fiori Vermentino 2018
7855,Chateau Peby Faugeres 2010
7856,Chateau Margaux Pavillon Blanc (Futures Pre-Sale) 2017
7857,Penfolds Max's Chardonnay 2017
7858,Stadt Krems Gruner Veltliner Kremstal 2018
7859,Booker Vineyard White 2016
7860,Bodegas Benjamin Rothschild and Vega Sicilia Macan 2014
7861,Sandhi Sanford and Benedict Pinot Noir 2015
7862,Mastroberardino Radici Fiano di Avellino 2016
7863,Chateau du Moulin a Vent Moulin-a-Vent 2014
7864,Chateau Larrivet Haut-Brion 2012
7865,Zuccardi Finca Los Membrillos 2011
7866,Chateau Gassier Le Pas du Moine Rose 2018
7867,Yealands Estate Single Vineyard Sauvignon Blanc 2018
7868,AXR Napa Valley Cabernet Sauvignon 2014
7869,Clos Apalta Le Petit Clos Apalta 2014
7870,Adelsheim Staking Claim Chardonnay 2015
7871,Domaine Pinson Freres Chablis Montmain Premier Cru 2017
7872,Leese-Fitch Zinfandel 2016
7873,Kendall-Jackson Vintner's Reserve Pinot Gris 2016
7874,Schloss Gobelsburg Brut Reserve
7875,J.M. Gobillard & Fils Brut Tradition
7876,Bouchaine Estate Chardonnay 2015
7877,Cuvaison Chardonnay 2017
7878,Mousse Fils Tradition Rose
7879,Zardetto Cuvee Rose
7880,Rapido Pinot Grigio 2017
7881,Pindar Peacock Chardonnay 2017
7882,Ravines Gewurtztraminer 2017
7883,Buglioni Il Vigliacco Spumante Brut Rose 2018
7884,Le Salette Amarone Classico 2014
7885,Bertani Valpantena Amarone 2015
7886,Bertani Velante Pinot Grigio 2017
7887,Tenuta Polvaro Nero 2013
7888,Bertani Valpantena Amarone 2016
7889,Wolffer Estate Classic Red 2016
7890,Fox Run Vineyards Doyle Family Chardonnay 2017
7891,Le Salette Pergole Vece Amarone 2013
7892,Masi Modello delle Venezie Rosso 2016
7893,Domaine Paul Buisse Touraine Sauvignon 2018
7894,La Fiera Primitivo Salento 2017
7895,Villa Sandi Pinot Grigio 2017
7896,Tommasi Le Rosse Pinot Grigio 2018
7897,Masi Rosa dei Masi 2018
7898,Tommasi Amarone 2015
7899,Mionetto Extra Dry Presitge Rose
7900,La Fiera Pinot Grigio 2017
7901,Pindar Sweet Scarlet
7902,Pascal Janvier Jasnieres 2017
7903,Bertani Bertarose 2018
7904,Buglioni Il Bugiardo Classico Superiore Ripasso 2015
7905,Torresella Pinot Grigio 2017
7906,Tenuta Polvaro Oro 2017
7907,Bertani Secco-Bertani Original Vintage Edition 2014
7908,Zenato Amarone 2015
7909,Maeli Infinito Rosso 2016
7910,Pindar Pythagoras
7911,Pascal Janvier Coteaux du Loir Blanc 2017
7912,Cesari Mara Ripasso 2016
7913,Pindar Sunflower Special Reserve Chardonnay 2015
7915,Le Salette La Marega Amarone 2014
7916,Mionetto Il Moscato
7917,Folonari Venezie Merlot 2016
7918,Anselmi San Vincenzo 2017
7919,Domaine Anne Gros Bourgogne Pinot Noir 2016
7920,Hermann J. Wiemer Dry Riesling 2017
7921,Tenuta Polvaro Lison Classico 2013
7922,Zenato Pinot Grigio 2018
7923,Zenato Merlot Corvina Cormi 2013
7924,Bertani Bertarose 2017
7925,Tenuta Polvaro Pinot Grigio 2017
7926,Livio Sassetti Pertimali Brut Spumante
7927,Domaine Thomas Morey Bourgogne Chardonnay 2016
7928,Wolffer Estate Cabernet Franc 2017
7929,J. Christopher Nuages Pinot Noir 2012
7930,Schrader RBS To Kalon Vineyard Cabernet Sauvignon 2016
7931,Vetus Flor de Vetus Verdejo 2016
7932,Avalon Napa Cabernet Sauvignon 2016
7933,Anthill Farms Anderson Valley Pinot Noir 2016
7934,Louis Latour Meursault Blanc 2016
7935,Joseph Drouhin Cote de Beaune 2016
7936,Bodegas Mauro 2016
7937,Mauro Veglio 2043 Barolo 2014
7938,Alain Chavy Puligny-Montrachet Les Folatieres Premier Cru 2016
7940,Nicolas Maillet Macon Verze 2016
7941,Merry Edwards Sonoma Coast Pinot Noir 2016
7942,Spring Valley Frederick Estate Red 2015
7943,Textbook Mise en Place Cabernet Sauvignon 2016
7944,Escarpment Te Rehua Pinot Noir 2014
7945,Cliff Lede Stags Leap District Cabernet Sauvignon 2016
7946,Mitolo G.A.M. 2014
7947,Berlucchi Franciacorta Brut
7948,Domaine Louis Michel et Fils Chablis 2017
7949,Clonakilla Shiraz Viognier 2014
7950,Robert Mondavi Reserve Chardonnay 2015
7951,Lucia Vineyards Santa Lucia Highlands Chardonnay 2016
7952,Luigi Pira Barolo Vigna Rionda 2012
7953,Lang & Reed Mendocino Chenin Blanc 2016
7954,Brick & Mortar Manchester Ridge Vineyard Chardonnay 2016
7955,Spellbound Pinot Noir 2016
7956,Sojourn Beckstoffer Vineyard Georges III Cabernet Sauvignon 2015
7957,Jermann Dreams 2017
7958,Antoniolo Castelle Gattinara 2013
7959,Carol Shelton Pizazz Zinfandel 2015
7960,Scheid Vineyards Reserve Pinot Noir 2014
7961,Lincourt Rancho Santa Rosa Pinot Noir 2016
7962,Penfolds St. Henri Shiraz 2015
7963,Noon Reserve Shiraz 2012
7964,Delas Hermitage Les Bessards 2012
7965,Chateau Margaux (Futures Pre-Sale) 2018
7966,Chateau Mouton Rothschild (Futures Pre-Sale) 2018
7967,Chateau Haut-Brion (Futures Pre-Sale) 2018
7968,Davis Family Vineyards Cuvee Luke 2014
7969,Quinta de Chocapalha Castelao Red 2014
7971,Ferreira Casa Ferreirinha Vinha Grande Rose 2016
7972,Sanford Flor de Campo Chardonnay 2016
7973,Joao Portugal Ramos Vila Santa Loios Red 2017
7974,Nielson Santa Barbara Chardonnay 2015
7975,Warre's Fine White Port
7976,Hitching Post Hometown Pinot Noir 2017
7977,Hitching Post Hartley Ostini Generation Red 2017
7978,Herdade Do Esporao Monte Velho White 2017
7979,Pali Wine Co Huntington Pinot Noir 2015
7980,Fonseca Ruby Port
7981,Herdade Do Esporao Verdelho 2017
7982,Quinta do Crasto Douro Red Reserva Old Vines 2014
7983,Quinta Nova Cla Moscatel
7984,Diatom Bar-M Vineyard Chardonnay 2018
7985,Jaffurs Viognier 2016
7986,Quinta do Crasto Douro White 2016
7987,Jose Maria Da Fonseca Domini 2011
7988,Dow's Fine White Port
7989,Ferreira Esteva 2017
7990,Varner Los Alamos Vineyard Pinot Noir 2014
7991,Etude Lyric Chardonnay 2016
7992,Fonseca Siroco White Port
7993,Altano Douro 2016
7994,Real Companhia Velha Porca de Murca 2017
7995,Bianchi Vineyards Signature Chardonnay 2015
7996,Santa Barbara Winery Santa Barbara Pinot Noir 2016
7997,Quinta do Crasto Douro Touriga Nacional 2015
7998,La Fenetre A'Cote Chardonnay 2013
7999,Au Bon Climat Santa Barbara Chardonnay 2017
8000,Quinta Nova Cla Port Special Reserve
8001,Ferreira Casa Ferreirinha Vinha Grande 2016
8002,Pence Estate Chardonnay 2014
8003,Ferreira Casa Ferreirinha Planalto 2017
8004,Hitching Post Hometown Pinot Noir 2016
8005,Quinta da Romaneira R de Romaneira 2015
8006,Terra d'Oro Pinot Grigio 2016
8007,Tyler Winery Santa Barbara County Pinot Noir 2017
8008,Ferreira Casa Ferreirinha Papa Figos Red 2017
8009,Ramos Pinto Late Bottled Vintage Port 2012
8010,Greg Norman Estates Santa Barbara County Pinot Noir 2016
8011,Duorum Tons de Duorum Red Blend 2014
8012,Broadbent 5 Year Madeira Reserve
8013,Taylor Fladgate Late Bottled Vintage Port 2014
8014,Jose Maria Da Fonseca Periquita Reserva 2016
8015,Dow's Late Bottled Vintage 2012
8016,Ampelos Cellars Syrache 2013
8017,Hitching Post Cork Dancer Pinot Noir 2016
8018,Piedrasassi P.S. Syrah 2017
8019,Hitching Post Highliner Pinot Noir 2016
8020,Five Rivers Pinot Noir 2017
8021,Quinta do Crasto Douro Superior Red 2015
8022,Oregon Territory Pinot Noir 2014
8023,Colgin IX Estate Syrah 2015
8024,Rutherford Ranch 2 Range Red 2015
8025,Morgante Don Antonio Nero d'Avola Riserva 2015
8026,Dueling Pistols Dry Creek Red Blend 2016
8027,Brewer-Clifton Sta. Rita Hills Pinot Noir 2014
8028,Gagliole Valletta 2015
8029,Orma Passi di Orma 2016
8030,Domaine Henri Delagrange Volnay Vieilles Vignes 2016
8031,Calera Central Coast Chardonnay 2016
8032,Keenan Reserve Cabernet Sauvignon 2013
8033,Beau Vigne Cult Cabernet Sauvignon 2013
8034,Stringtown Pinot Noir 2017
8035,Acrobat Rose of Pinot Noir 2018
8036,Elouan Chardonnay 2017
8037,King Estate Backbone Pinot Noir 2014
8038,King Estate Sauvignon Blanc 2018
8039,Erath Pinot Gris 2016
8040,A to Z Rose Bubbles
8041,Francis Ford Coppola Oregon Pinot Noir 2017
8042,Elouan Rose 2018
8043,Firesteed Pinot Gris 2015
8044,Wither Hills Pinot Noir 2014
8045,Mullineux Family Wines Old Vines White Blend 2016
8046,Mac Forbes Yarra Valley Pinot Noir 2017
8047,Brancott Letter Series T Estate Pinot Noir 2016
8048,Ponzi Pinot Noir Rose 2016
8049,William Hill North Coast Cabernet Sauvignon 2017
8050,William Hill North Coast Sauvignon Blanc 2016
8051,Hess Select Cabernet Sauvignon 2016
8052,Sebastiani North Coast Chardonnay 2016
8053,Menage a Trois Cabernet Sauvignon 2016
8054,Longboard North Coast Sauvignon Blanc 2017
8055,Carol Shelton Rendezvous Rose 2016
8056,Cultivar Cabernet Sauvignon 2015
8057,Guenoc Victorian Claret 2016
8058,Schramsberg Blanc de Blancs 2016
8059,William Hill North Coast Chardonnay 2017
8060,Murphy-Goode The Fume 2017
8061,Sebastiani North Coast Merlot 2016
8062,Folk Machine Charbono 2017
8063,Buena Vista North Coast Cabernet Sauvignon 2016
8064,B.R. Cohn Silver Label Cabernet Sauvignon 2017
8065,Fisher Vineyards Unity Cabernet Sauvignon 2016
8066,The Federalist Honest Red Blend 2016
8067,Benziger Sauvignon Blanc 2017
8068,Chateau Pontet-Canet 2012
8069,Charles Heidsieck Vintage Rose 2006
8070,Diamond Creek Gravelly Meadow Cabernet Sauvignon 2015
8071,Diamond Creek Volcanic Hill Cabernet Sauvignon 2016
8072,Domaine Matrot Meursault Charmes Premier Cru 2017
8073,Diamond Creek Volcanic Hill Cabernet Sauvignon 2015
8074,CADE Reserve Cabernet Sauvignon Howell Mountain 2015
8075,Winderlea Dundee Hills Pinot Noir 2013
8076,Rhys Vineyards Alesia Santa Cruz Mountains Chardonnay 2016
8077,Dow's Trademark Finest Reserve Port
8078,Ceretto Rossana Dolcetto d'Alba 2016
8079,Matthiasson Red Hen Vineyard Merlot 2013
8080,Blue Farm Laceroni Vineyard Chardonnay 2013
8081,Banfi Summus 2015
8082,Koyle Auma 2013
8083,Louis Jadot Meursault 2016
8084,Bouchard Pere & Fils Beaune Clos St Landry Premier Cru Monopole 2016
8085,Pulenta Gran Cabernet Franc XI 2014
8086,Failla Keefer Ranch Chardonnay 2014
8087,Gary Farrell Olivet Lane Chardonnay 2016
8088,Didier Dagueneau Pouilly Fume Pur Sang 2005
8089,Hacienda Araucano Gran Araucano Cabernet Sauvignon 2014
8090,Aubert Powder House Chardonnay 2017
8091,Amity Willamette Valley Pinot Noir 2015
8092,Willamette Valley Vineyards Whole Cluster Rose of Pinot Noir 2018
8093,Leth Hofweingarten Lagenreserve Roter Veltliner 2015
8094,Montinore Red Cap Pinot Noir 2017
8095,Ayres Willamette Valley Pinot Noir 2017
8096,Ken Wright Cellars Guadalupe Vineyard Pinot Noir 2016
8097,Soter Vineyards North Valley Reserve Pinot Noir 2014
8098,Penner-Ash Oregon Syrah 2014
8099,Westrey Abbey Ridge Pinot Noir 2014
8100,King Estate Willamette Valley Pinot Gris 2017
8101,Soter Vineyards North Valley Pinot Noir 2016
8102,Ken Wright Cellars Bonnie Jean Vineyard Pinot Noir 2015
8103,Biblia Chora Estate White 2017
8104,Ironstone Reserve Meritage 2013
8105,Ironstone Reserve Cabernet Franc 2016
8106,Cooper Mountain Cooper Hill Pinot Noir 2016
8107,Cooper Mountain Life Pinot Noir 2017
8108,Leth Hofweingarten Lagenreserve Roter Veltliner 2016
8109,Adelsheim Pinot Gris 2017
8110,Westrey Oracle Vineyard Pinot Noir 2012
8111,Lange Winery Reserve Pinot Noir 2014
8112,St. Innocent Momtazi Hill Pinot Noir 2015
8113,Eyrie Estate Pinot Noir 2015
8114,J.K. Carriere Anderson Family Pinot Noir 2014
8115,Ironstone Reserve Chardonnay 2016
8116,Torii Mor Pinot Gris 2014
8117,Elk Cove Clay Court Pinot Noir 2015
8118,Brooks Willamette Valley Pinot Noir 2017
8119,Patricia Green Sauvignon Blanc 2017
8120,Ken Wright Cellars Tanager Pinot Noir 2015
8121,Chanson Pere & Fils Vire Clesse 2016
8122,Sokol Blosser Pinot Gris 2015
8123,Weingut Durnberg Weinviertel Falkenstein Riesling 2015
8124,Weingut Durnberg Weinviertel Falkenstein Riesling 2016
8125,Broadley Claudia's Choice Pinot Noir 2013
8126,Antiquum Farm Juel Pinot Noir 2017
8127,Ken Wright Cellars McCrone Vineyard Pinot Noir 2015
8128,Hamacher Wines Cuvee Forets Diverses Chardonnay 2014
8129,Ironstone Reserve Cabernet Sauvignon 2014
8130,Scenic Root Winegrowers Willamette Valley The Forager Pinot Noir 2017
8131,Kir-Yianni Akakies Rose 2018
8132,Montinore Almost Dry Riesling 2018
8133,Solena Estate Grand Cuvee Pinot Noir 2015
8134,Lange Winery Willamette Valley Pinot Noir 2017
8135,Weingut Durnberg Weinviertel Falkenstein Gruner Veltliner 2016
8136,Westrey Reserve Pinot Noir 2012
8137,Firesteed Riesling 2016
8138,Lange Winery Freedom Hill Vineyard Pinot Noir 2014
8139,Glatzer Gruner Veltliner 2017
8140,Markus Huber Alte Setzen Gruner Veltliner 2012
8141,Stoller Pinot Noir Rose 2018
8142,Hamacher Wines Pinot Noir 2014
8143,Lemelson Chardonnay Reserve 2014
8144,Beaux Freres Willamette Valley Pinot Noir 2017
8145,Elk Cove Clay Court Pinot Noir 2017
8146,Biblia Chora Ovilos Regional White 2016
8147,Soter Vineyards North Valley Chardonnay 2017
8148,Johan Vineyards Estate Pinot Noir 2015
8149,Owen Roe Sharecropper's Pinot Noir 2017
8150,Ken Wright Cellars Guadalupe Vineyard Pinot Noir 2015
8151,Hamacher Wines H Series Pinot Noir 2014
8152,Cooper Mountain Reserve Pinot Noir 2015
8153,Roco Gravel Road Pinot Noir 2016
8154,Cristom Mt. Jefferson Cuvee Pinot Noir 2017
8155,King Estate Willamette Valley Rose of Pinot Noir 2018
8156,Louis Latour Macon-Lugny Les Genievres 2017
8157,Lemelson Meyer Vineyard Pinot Noir 2014
8158,Henri Perrusset Macon-Farges Vieilles Vignes 2016
8159,Ransom Jigsaw Pinot Noir 2016
8160,Weingut Durnberg Tradition Gruner Veltliner Reserve 2016
8161,Domaine Serene R Rose 2010
8162,Ransom Selection Pinot Noir 2014
8163,Pali Wine Co Alphabets Pinot Noir 2016
8164,Antiquum Farm Passiflora Pinot Noir 2017
8165,Lemelson Chardonnay Reserve 2013
8166,Alexana Terroir Selection Pinot Noir 2015
8167,Momokawa Organic Junmai Ginjo
8168,Westrey Pinot Noir 2013
8169,Leth Lagenreserve Felser Weinberge Riesling 2016
8170,Ken Wright Cellars Savoya Vineyard Pinot Noir 2015
8171,Johan Vineyards Estate Pinot Noir 2014
8172,Ken Wright Cellars Canary Hill Vineyard Pinot Noir 2015
8173,Firesteed Willamette Valley Pinot Noir 2017
8174,Cooper Mountain Reserve Pinot Noir 2014
8175,Glatzer Zweigelt Riedencuvee 2017
8176,J. Christopher Willamette Valley Sauvignon Blanc 2015
8177,Brick House Gamay Noir 2017
8178,Johan Vineyards Pinot Gris 2015
8179,Lange Winery Three Hills Cuvee Chardonnay 2014
8180,J.K. Carriere Antoinette Pinot Noir 2015
8181,Raptor Ridge Pinot Gris 2016
8182,Argyle Brut 2015
8183,Alexakis Assyrtiko 2018
8184,Clos Saron Carte Blanche 2016
8185,Siduri Willamette Valley Pinot Noir 2017
8186,La Crema Willamette Valley Pinot Noir 2017
8187,Van Duzer Pinot Gris 2018
8188,Great Oregon Wine Co. Rascal Pinot Gris 2017
8189,Ponzi Pinot Noir Rose 2018
8190,Jonata Tierra Sangiovese 2010
8191,Chateau Bellevue Mondotte 2012
8192,Quinta do Vesuvio Douro Red 2014
8193,Siro Pacenti Vecchie Vigne Brunello di Montalcino 2012
8194,Stanton Vineyards Oakville Cabernet Sauvignon 2014
8195,Delectus Cabernet Franc 2013
8196,Sokol Blosser Pinot Gris 2017
8197,Carpe Diem Chardonnay 2016
8198,Hiedler Maximum Riesling 2016
8199,Castro Candaz A Boca do Demo Ribeira Sacra Tinto 2016
8200,Bodegas y Vinedos Alion 2015
8201,Ca'Momi Bianco di Ca'Momi 2016
8202,Rickshaw Chardonnay 2017
8203,Miner Family Viognier 2017
8204,Geyser Peak Chardonnay 2015
8205,Bonny Doon Gravitas 2015
8206,Dashe Vineyard Select Zinfandel 2017
8207,Jamieson Ranch Vineyards Whiplash Red Blend 2016
8208,Spellbound Cabernet Sauvignon 2016
8209,Wild Ridge Pinot Noir 2014
8210,AXR Napa Valley Chardonnay 2015
8211,Failla Chuy Vineyard Chardonnay 2013
8212,Fontanafredda Barbaresco 2015
8213,Cecchi Vino Nobile di Montepulciano 2014
8214,Luca G Lot Chardonnay 2016
8215,Lioco Saveria Pinot Noir 2013
8216,Dr. Thanisch Bernkasteler Doctor Kabinett Riesling 2016
8217,Domaine de la Solitude Cotes du Rhone Rose 2017
8218,Terrabianca Chianti Classico Riserva Croce 2014
8219,Roberto Voerzio Vigneti Cerreto Barbera d'Alba 2013
8220,14 Hands Pinot Grigio 2016
8221,Charles Smith Band of Roses Rose 2018
8222,Boomtown by Dusted Valley Syrah 2017
8223,Charles Smith Velvet Devil Merlot 2016
8224,Woodward Canyon Nelm's Road Red 2015
8225,Boomtown by Dusted Valley Merlot 2017
8226,14 Hands Chardonnay 2015
8227,14 Hands Hot to Trot White Blend 2016
8228,Hickinbotham Brooks Road Shiraz 2013
8229,Cote Bonneville DuBrul Vineyard Syrah 2011
8230,Nickel & Nickel Suscol Ranch Merlot 2015
8231,Markus Huber Terrassen Gruner Veltliner 2017
8232,Gianni Gagliardo Barolo 2014
8233,Mount Veeder Winery Reserve Red 2009
8234,Castello di Bossi Chianti Classico Gran Selezione 2013
8235,Chateau Grand-Puy-Lacoste 2011
8236,Chateau Kirwan 2011
8237,Bouchard Pere & Fils Pommard 2016
8238,Louis Latour Beaune Vignes Franches Premier Cru 2013
8239,Chateau Lafon-Rochet 2009
8240,Domaine Tollot-Beaut Aloxe Corton 2016
8241,Roger Sabon Chateauneuf-du-Pape Prestige 2012
8242,The Chook Sparkling Shiraz
8244,Pietradolce Archineri Etna Rosso 2016
8245,Vatan Tinta de Toro 2014
8246,Fess Parker Santa Barbara Chardonnay 2017
8247,Radio-Coteau Savoy Chardonnay 2015
8248,Tyler Winery Sanford and Benedict Chardonnay 2016
8249,Sojourn Durell Vineyard Chardonnay 2016
8250,Clos Saint-Jean Vieilles Vignes Chateauneuf-du-Pape 2013
8251,Best's Great Western Bin No 0 Shiraz 2015
8252,Behrens & Hitchcock Alder Springs Vineyard Homage to Ed Oliveira 2001
8253,The Crane Assembly G.B. Crane Vineyard Cabernet Sauvignon 2014
8254,Playtime Red 2016
8255,Baron Herzog Lake County Special Reserve Cabernet Sauvignon 2016
8256,Shannon Ridge Buck Shack Cabernet Sauvignon 2017
8257,Hagafen Lake County White Riesling 2017
8258,Playtime Blonde Chardonnay 2015
8259,Shannon Ridge High Elevation Chardonnay 2017
8260,Six Sigma Ranch and Vineyards Cuvee Diamond Mine 2014
8261,Steele Writer's Block Malbec 2015
8262,Guenoc Lake County Petite Sirah 2014
8263,Shannon Ridge High Elevation Cabernet Sauvignon 2017
8264,Erath Rose of Pinot Noir 2017
8265,Mindego Ridge Chardonnay 2014
8266,Pax Gamay 2016
8267,Chapter 24 Fire and Flood The Fire Pinot Noir 2014
8268,Anthill Farms Comptche Ridge Vineyard Pinot Noir 2016
8269,Salvestrin Three D Cabernet Sauvignon 2013
8270,Clos Guirouilh Jurancon 2012
8271,St. Innocent Temperance Hill Vineyard Pinot Noir 2015
8272,Morlet En Famille Pinot Noir 2014
8273,Melville Clone 76 Inox Chardonnay 2017
8274,Giovanni Rosso Barolo Serra 2014
8275,Heitz Cellar Ink Grade Vineyard Port
8276,Sottimano Barbaresco Pajore 2015
8277,Quinta de Roriz Vintage Port 2016
8278,L10 by Valentin Bianchi Premium Malbec 2016
8279,Elsa Bianchi Chardonnay 2014
8280,Kaiken Reserva Cabernet Sauvignon 2017
8281,Ernesto Catena Selections Siesta Cabernet Sauvignon 2013
8282,Ernesto Catena Selections Tahuan Cabernet Sauvignon 2012
8283,Pascual Toso Estate Chardonnay 2014
8284,L10 by Valentin Bianchi Premium Malbec 2015
8285,Bodegas Callia Alta Malbec 2018
8286,Norton Britto Artist Label Barrel Select Sauvignon Blanc 2018
8287,Elsa Bianchi Torrontes 2018
8288,Altos las Hormigas Colonia Las Liebres Bonarda 2018
8289,Vina Alicia Paso de Piedra Malbec 2014
8290,Trapiche Medalla Cabernet Sauvignon 2013
8291,Bodegas Renacer Milamore 2014
8292,Elsa Bianchi Torrontes 2017
8293,Trapiche Broquel Cabernet Sauvignon 2015
8295,Bevan Cellars Tench Vineyard Cabernet Sauvignon 2016
8296,Lewis Cellars Reserve Cabernet Sauvignon 2015
8297,Trentadue OPR Sauvignon Blanc 2017
8298,Mt. Beautiful Chardonnay 2014
8299,Francis Ford Coppola Sofia Mini Blanc de Blancs 4-Pack
8300,Scheid Vineyards Sauvignon Blanc 2017
8301,Kendall-Jackson Vintner's Reserve Riesling 2017
8302,Carmel Road Monterey Unoaked Chardonnay 2017
8303,Bridlewood Monterey Pinot Noir 2017
8304,Francis Ford Coppola Director's Chardonnay 2016
8305,Five Rivers Merlot 2015
8306,Scheid Vineyards Pinot Noir 2016
8307,Bernardus Monterey County Sauvignon Blanc 2017
8308,Scheid Vineyards Clone Series 667 Reserve Pinot Noir 2015
8309,Hahn Winery Monterey Chardonnay 2017
8310,Concannon Monterey Chardonnay 2016
8311,Francis Ford Coppola Sofia Brut Rose 2017
8312,La Crema Monterey Pinot Gris 2017
8313,Vinum Cellars Pinot Noir 2014
8314,Bridlewood Monterey County Chardonnay 2016
8315,Hess Select Chardonnay 2017
8316,J. Lohr Wildflower Valdiguie 2018
8317,Big Basin Gabilan Mountains GSM 2012
8318,Estancia Pinot Noir 2017
8319,Jekel Riesling 2016
8320,Mountain View Winery Monterey Chardonnay 2014
8321,Francis Ford Coppola Sofia Blanc de Blancs 2016
8322,Estancia Unoaked Chardonnay 2016
8323,Robert Mondavi Private Selection Bourbon Barrels Chardonnay 2017
8324,J. Lohr Bay Mist White Riesling 2017
8325,Toad Hollow Monterey Pinot Noir 2016
8326,Hahn Winery Monterey Pinot Gris 2018
8327,Estancia Chardonnay 2017
8328,Estancia Sauvignon Blanc 2017
8329,Five Rivers Cabernet Sauvignon 2016
8330,Bianchi Vineyards Signature Selection Sauvignon Blanc 2017
8331,Bernardus Monterey County Pinot Noir 2014
8332,La Crema Pinot Noir Rose 2018
8333,Jekel Pinot Noir 2014
8334,Bianchi Vineyards Signature Selection Sauvignon Blanc 2016
8335,Hahn Winery Monterey Pinot Noir 2017
8336,Cedar + Salmon Willamette Valley Pinot Gris 2018
8337,Ridgeview Wine Estate Blanc de Noir 2013
8338,Ram's Gate Winery Green Acres Hill Vineyard Chardonnay 2014
8339,Bastianich Plus 2011
8340,Chateau Margaux Pavillon Blanc (Futures Pre-Sale) 2018
8341,Chateau Montrose 2012
8342,DeLoach Forgotten Vines Zinfandel 2011
8343,Drinkward Peschon Entre Deux Meres Cabernet Sauvignon 2014
8344,Snowden The Brothers Cabernet Sauvignon 2014
8345,Terlano Winkl Sauvignon Blanc 2018
8346,Vie di Romans Dessimis Pinot Grigio 2016
8347,Tramin Stoan 2017
8348,Alphonse Mellot La Moussiere Sancerre Rouge 2014
8349,Planeta Moscato di Noto 2015
8350,Quinta da Romaneira 10 Year Tawny Port
8351,Peter Zemmer Pinot Grigio 2018
8352,Podere Brizio Rosso di Montalcino 2015
8353,Cono Sur 20 Barrels Cabernet Sauvignon 2015
8354,Astrolabe Province Pinot Noir 2013
8355,Graham's 30 Year Old Tawny Port
8356,Tzora Shoresh Red 2016
8357,Vinum Cellars Napa Valley Cabernet Sauvignon 2014
8358,Whitehall Lane Cabernet Sauvignon 2015
8359,Ramey Napa Valley Claret 2016
8360,A.J. Adam Dhron Hofberg Kabinett Riesling 2017
8361,Valdespino Pedro Ximenez El Candado
8362,Saintsbury Lee Vineyard Carneros Pinot Noir 2016
8363,Ramey Sidebar Ritchie Vineyard Sauvignon Blanc 2015
8364,David Bruce Russian River Chardonnay 2015
8365,Sanctuary Chardonnay 2014
8366,Quady Vya Extra-Dry Vermouth
8367,Haute Couture Rose
8368,Yalumba Tri-Centenary Vineyard Grenache 2013
8369,M by Michael Mondavi Cabernet Sauvignon 2014
8370,Abbona Pressenda Barolo 2012
8371,Feudi di San Gregorio Taurasi 2013
8372,Arnaldo Caprai Sagrantino di Montefalco Collepiano 2013
8373,Fratelli Revello Barolo Gattera 2013
8374,Roger Sabon Chateauneuf-du-Pape Les Secret des Sabon 2012
8375,Jean-Charles Fagot Chassagne-Montrachet Vieilles Vignes Rouge 2016
8376,Tornatore Pietrarizzo Etna Rosso 2016
8377,Chapter 24 Last Chapter Pinot Noir 2016
8378,Arnot-Roberts Trout Gulch Vineyards Chardonnay 2017
8379,Gerard Bertrand Languedoc 2014
