4163,Au Bon Climat Nuits Blanches Au Bouge Chardonnay 2014
4164,Rodney Strong Charlotte's Home Sauvignon Blanc 2017
4165,Dal Forno Romano Valpolicella Superiore 2011
4166,Leo Steen Jurassic Vineyard Chenin Blanc 2015
4167,La Spinetta Barolo Garretti 2015
4168,Poggio Antico Brunello di Montalcino 2013
4169,Quinta de la Rosa La Rosa Estate Reserve Red 2015
4170,La Gerla Brunello di Montalcino 2013
4171,Sterling Napa Sauvignon Blanc 2017
4172,Chehalem 3 Vineyard Pinot Gris 2017
4173,Chateau Angelus 2016
4174,Heritance Sauvignon Blanc 2017
4175,Roger Sabon Chateauneuf-du-Pape Renaissance Blanc 2017
4176,Chateau Maris Las Combes 2017
4177,Heritiers du Comte Lafon Pouilly-Fuisse En Chatenay 2017
4178,Vistalba Corte A 2009
4179,Mendel Unus 2014
4180,Luc Belaire Gold
4181,La Chablisienne Chablis Grand Cru Chateau Grenouilles 2014
4182,DAOU Vineyards Soul of a Lion 2015
4183,Fontodi Flaccianello della Pieve 2001
4184,Taurino Salice Salentino 2010
4185,Hiedler Riesling Ried Heiligenste Erste Lage 2017
4186,B.R. Cohn Silver Label Chardonnay 2016
4187,Kenwood Six Ridges Chardonnay 2017
4188,Geyser Peak River Ranches Sauvignon Blanc 2015
4189,Balletto Winery Teresa's Unoaked Chardonnay 2016
4190,Cline Cashmere White 2017
4191,Gustave Lorentz Cremant D'Alsace
4192,Nals Margreid Pinot Grigio 2017
4193,Landmark Overlook Pinot Noir 2016
4194,Joel Gott 14 Cabernet Sauvignon 2014
4195,Wind Gap Armagh Vineyard Syrah 2012
4196,La Follette Sangiacomo Pinot Noir 2016
4197,Clos de l'Oratoire des Papes 2016
4198,Gaia Agiorgitiko 2016
4199,Barone Ricasoli Brolio Chianti Classico 2015
4200,Kendall-Jackson Grand Reserve Chardonnay 2017
4201,Familia Montana Rioja Crianza 2016
4202,Vinos Valtuille Pago de Valdoneje Roble Mencia 2015
4203,Chateau Malartic-Lagraviere La Reserve de Malartic Blanc 2016
4204,Burrier Chateau de Beauregard Saint-Veran 2016
4205,Chateau Sainte Marguerite Love Provence Rose 2018
4206,Laurenz V Charming Gruner Veltliner 2015
4207,Ramey Sonoma Coast Chardonnay 2015
4208,Weingut Hirsch Zobing Riesling 2015
4209,K Vintners El Jefe 2016
4210,Rodney Strong Brothers Vineyard Cabernet Sauvignon 2015
4211,CVNE Gran Reserva 2012
4212,Chateau Le Boscq 2015
4213,Lioco Estero Chardonnay 2015
4214,Hanzell Sebella Chardonnay 2017
4215,TerraNoble Gran Reserva Cabernet Sauvignon 2015
4216,Eighty Four Albarino 2017
4217,Ken Forrester Renegade 2014
4218,Chateau Pichon-Longueville Baron (Futures Pre-Sale) 2017
4219,Arrowood Proprietary Red 2013
4220,Gloria Ferrer Blanc de Blancs
4221,Nautilus Sauvignon Blanc 2018
4222,Clos Fourtet 2016
4223,Mahi Marlborough Sauvignon Blanc 2017
4224,Billaud-Simon Chablis Les Vaillons Premier Cru 2016
4225,Edmunds St. John Barsotti Ranch Syrah 2014
4226,Caparzo Brunello di Montalcino La Casa 2012
4227,Amelia Brut Rose Cremant de Bordeaux
4228,St. Supery Rutherford Cabernet Sauvignon 2012
4229,Peirson Meyer Napa Valley Cabernet Sauvignon 2015
4230,Reata Sonoma Coast Chardonnay 2017
4231,MacRostie Sonoma Coast Chardonnay 2017
4232,Chalk Hill Sonoma Coast Chardonnay 2017
4233,Titus Cabernet Sauvignon 2016
4234,Crossbarn by Paul Hobbs Napa Valley Cabernet Sauvignon 2015
4235,Niepoort Drink Me Nat’Cool 2017
4236,Chloe Pinot Grigio 2017
4237,Oxford Landing Sauvignon Blanc 2017
4238,Bodega Garzon Uruguay Single Vineyard Petit Verdot 2015
4239,Domaine du Pesquier Gigondas 2015
4240,Guy Breton Regnie 2017
4241,Joseph Drouhin Chorey Les Beaune 2016
4242,Santa Cristina by Antinori Pinot Grigio 2017
4243,Cabreo La Pietra Chardonnay 2016
4244,Domaine Mittnacht Freres Rosacker Riesling Grand Cru 2014
4245,Chronic Cellars Dead Nuts Red Blend 2016
4246,Chateau Ste. Michelle Indian Wells Vineyard Chardonnay 2016
4247,Seven Hills Winery Sauvignon Blanc 2016
4248,CVNE Crianza 2015
4249,Gabbiano Chianti Classico 2016
4250,Masciarelli Trebbiano d'Abruzzo 2018
4251,Rogue Vine Super Itata Tinto 2016
4252,Leese-Fitch Cabernet Sauvignon 2016
4253,Gonet-Medeville Tradition Premier Cru
4254,Cigar Box Old Vine Pinot Noir 2015
4255,Hacienda Araucano Reserva Carmenere 2017
4256,Maison L'Envoye Moulin-a-Vent 2016
4257,Jules Taylor Pinot Noir 2017
4258,Manuel Acha Vino Vermouth Rojo
4259,Dog Point Vineyard Section 94 Sauvignon Blanc 2015
4260,Shaw & Smith M3 Chardonnay 2016
4261,Rippon Vineyard Mature Vine Riesling 2016
4262,Los Vascos Le Dix 2015
4263,La Braccesca Bramasole Syrah 2009
4264,Gagliole Colli della Toscana Centrale 2013
4265,Saintsbury Sundawg Ridge Vineyard Pinot Noir 2015
4266,Peay Vineyards Savoy Vineyard Pinot Noir 2016
4267,Zind-Humbrecht Clos Windsbuhl Riesling 2014
4268,Graham Beck Brut Methode Cap Classique
4269,Feudo Maccari Rose 2017
4270,Orin Swift Cellars Slander Pinot Noir 2017
4271,Clos Saint-Jean Chateauneuf-du-Pape Blanc 2016
4272,Long Meadow Ranch Anderson Valley Chardonnay 2015
4273,Louis Jadot Macon-Villages 2017
4274,Foxen Santa Maria Valley Pinot Noir 2016
4275,Philipponnat Brut Cuvee 1522 2007
4276,Chamisal Vineyards Sta. Rita Hills Chardonnay 2016
4277,Domaine Eden Chardonnay 2015
4278,Philipponnat Extra Brut Cuvee 1522 2008
4279,Brick & Mortar Vin Clair Pinot-Chardonnay 2017
4281,Buehler Estate Cabernet Sauvignon 2015
4282,Rosatello Sparkling Rose
4283,Ponzi Classico Pinot Noir 2015
4284,Pra Otto Soave Classico 2018
4285,Morgadio Legado del Conde Albarino 2017
4286,Joao Portugal Ramos Alvarinho 2017
4287,Gaia Ritinitis Nobilis Retsina
4288,Tellus Chardonnay 2016
4289,Pazo San Mauro Albarino 2016
4290,Amalaya Blanco 2018
4291,Inama Bradisismo 2015
4292,Lokoya Howell Mountain Cabernet Sauvignon 2014
4293,Louis Martini Lot 1 Cabernet Sauvignon 2013
4294,Rocca delle Macie Campo Maccione Morellino di Scansano 2016
4295,Ampelos Cellars Syrache 2012
4296,Peregrine Pinot Noir 2014
4297,Frescobaldi Pomino Bianco 2017
4298,Dunham Cellars Lewis Estate Vineyard Riesling 2014
4299,Vina Sastre Crianza 2015
4300,Pecchenino Bricco Botti Dogliani Superiore Dolcetto 2015
4301,Hauner Salina Hiera 2016
4302,Chateau La Nerthe Chateauneuf-du-Pape Blanc 2016
4303,Pierre Sparr Mambourg Grand Cru Pinot Gris 2016
4304,Chateau de Puligny-Montrachet St-Aubin En Remilly Premier Cru 2015
4305,Domaine de Beaurenard Chateauneuf-du-Pape Blanc 2017
4306,Matthew Fritz North Coast Chardonnay 2017
4307,Anthill Farms Sonoma Coast Pinot Noir 2017
4308,Loimer Extra Brut
4309,Loimer Brut Rose Reserve
4310,Drew Fog Eater Pinot Noir 2016
4311,Laurel Glen Counterpoint Cabernet Sauvignon 2015
4312,Chateau Leoville Barton 2011
4313,Poet's Leap Riesling 2017
4314,Two Hands Sexy Beast Cabernet Sauvignon 2017
4315,Brittan Gestalt Block Pinot Noir 2014
4316,Chateau Pesquie Quintessence Blanc 2016
4317,Bruno Giacosa Barolo Falletto 2015
4318,Rutherford Ranch Cabernet Sauvignon 2016
4319,Broadbent Rainwater Madeira
4320,Gagliole Gallule Chianti Classico Riserva 2015
4321,Poderi Oddero Barolo Bussia Vigna Mondoca Riserva 2012
4322,Fonseca Vintage Port 2016
4323,M. Chapoutier La Combe Pilate 2016
4324,Los Vascos Chardonnay 2018
4325,Napa Cellars Sauvignon Blanc 2017
4326,Robert Mondavi Napa Valley Fume Blanc 2017
4327,Immich-Batterieberg Ellergrub Riesling 2016
4328,Claypool Cellars Sonoma Coast Pinot Noir 2014
4329,Schrader LPV Beckstoffer Las Piedras Cabernet Sauvignon 2012
4330,Alvaro Domecq Alburejo Oloroso
4331,Chateau Cos d'Estournel Pagodes de Cos 2014
4332,Courbis Cornas Champelrose 2014
4333,Domaine Jean Royer Chateauneuf-du-Pape Cuvee Prestige 2017
4334,Chateau Sociando-Mallet 2015
4335,Chateau de Pez 2015
4336,Louis Latour Chassagne-Montrachet Rouge 2015
4337,Domaine Matrot Meursault Rouge 2016
4338,Domaine Lafond Roc-Epine Chateauneuf-du-Pape 2013
4339,Haras de Pirque Albis 2016
4340,Guigal Chateauneuf-du-Pape 2015
4341,Haras de Pirque Albis 2015
4342,Luli Pinot Noir 2017
4343,Henriques Ruby Red Rose
4344,Andrew Januik Stone Cairn Cabernet Sauvignon 2015
4345,Catena Zapata Adrianna Vineyard River Stones Malbec 2015
4346,Mud House Sauvignon Blanc 2017
4347,DuMOL Estate Pinot Noir 2015
4348,Chateau Le Boscq 2016
4349,Chateau Haut-Beausejour 2016
4350,Masi Costasera Amarone Classico 2013
4351,Il Palagio Roxanne Toscana Rosso 2016
4352,Sandrone Dolcetto d'Alba 2017
4353,Elvio Cogno Mandorlo Dolcetto d'Alba 2017
4354,Chanin Duvarita Vineyard Pinot Noir 2014
4355,Masseria Surani Heracles Primitivo 2016
4356,Bodegas Valderiz Valdehermoso Roble 2016
4357,A Portela Mencia 2014
4358,Brocard Chablis Vaulorent Premier Cru 2017
4359,Agricola Aguaza Sa Ra Da Seleccion 2009
4360,De Martino Legado Carmenere 2015
4361,Small Vines Sonoma Coast Pinot Noir 2014
4362,The Calling Patriarch Pinot Noir 2014
4363,Chateau La Clotte 2015
4364,Domaine de la Janasse Chateauneuf-du-Pape Cuvee Chaupin 2012
4365,Elderton Barossa Valley Estate Cabernet Sauvignon 2014
4366,Balnaves The Blend 2015
4367,Resonance Decouverte Vineyard Pinot Noir 2015
4368,Francois Montand Brut Rose
4369,Fess Parker Marcella's White Blend 2015
4370,Etude Rose of Pinot Noir 2018
4371,Dr. Loosen Urziger Wurzgarten Kabinett 2017
4372,Emilio Lustau Peninsula Palo Cortado Sherry
4373,Emilio Lustau Don Nuno Dry Oloroso Sherry
4374,Skyside Claret 2016
4375,Laurenz V Singing Gruner Veltliner 2017
4376,Croft Quinta Da Roeda 2015
4377,Stuhlmuller Vineyards Alexander Valley Estate Chardonnay 2016
4378,Chateau Puech-Haut Prestige Rose 2018
4379,Eighty Four Malbec 2014
4380,Bila-Haut by Michel Chapoutier Occultum Lapidem Blanc 2016
4381,Chateau Francs Magnus Bordeaux Superieur 2015
4382,Chateau Reaut 2016
4383,Chateau de Tabuteau Lussac St. Emilion 2016
4384,Neyers 304 Sonoma Chardonnay 2017
4385,Clos Dalian Garnacha Crianza 2015
4386,Concha y Toro Casillero Del Diablo Red Blend Reserva 2017
4387,Aubert UV-SL Vineyard Chardonnay 2017
4388,Solena Estate Grand Cuvee Pinot Noir 2014
4389,Van Duzer Willamette Valley Pinot Noir 2016
4390,Shafer Hillside Select Cabernet Sauvignon 2003
4391,Achaval-Ferrer Finca Mirador Malbec 2013
4392,Onesta Bechthold Vineyard Cinsault 2013
4393,Besserat de Bellefon Brut Rose
4395,Stoller Reserve Pinot Noir 2016
4396,Robert Sinskey Vin Gris of Pinot Noir 2018
4397,Frog's Leap Napa Valley Sauvignon Blanc 2017
4398,Pecchenino Le Coste di Monforte Barolo 2013
4399,Stags' Leap Winery Viognier 2017
4400,Prats & Symington Chryseia Douro 2015
4401,High Valley Vineyards Sauvignon Blanc 2017
4402,St. Supery Dollarhide Estate Cabernet Sauvignon 2014
4403,Hacienda Araucano Reserva Cabernet Sauvignon 2015
4404,Clemens Busch Riesling Kabinett Marienburg 2016
4405,Domaine Jean-Hugues et Ghislaine Goisot Saint-Bris Exogyra Virgula 2017
4406,Rotari Brut 2013
4407,Gloria Ferrer Sonoma Brut
4408,Kenwood Sonoma Zinfandel 2015
4410,Red Car Sonoma Coast Pinot Noir 2014
4411,Chanin Sanford & Benedict Vineyard Pinot Noir 2016
4412,Silvio Grasso Barolo 2015
4413,Tenuta di Nozzole La Forra Chianti Classico Riserva 2013
4414,Sebastiani Gravel Bed Red Blend 2016
4415,Red Newt Cellars Riesling 2016
4416,Maddalena Cabernet Sauvignon 2014
4417,Sandeman 10 Year Old Tawny
4418,Paul Lato Wines The Prospect Sierra Madre Vineyard Pinot Noir 2014
4419,Chateau Lalande st-julien 2016
4420,Chateau Pavie 2016
4421,Chateau de Beaucastel Hommage Jacques Perrin Chateauneuf-du-Pape 2001
4422,Chateau Pavie 2015
4423,Caposaldo Chianti 2016
4424,Chateau Bel-Air Jean & Gabriel Lussac St.-Emilion (Futures Pre-Sale) 2018
4425,Bortoluzzi Sauvignon 2017
4426,Delaire Graff Sauvignon Blanc 2017
4427,Parducci Small Lot Merlot 2015
4428,Robert Foley Vineyards Claret 2003
4429,Chateau Lagrezette Chevalier de Lagrezette 2013
4430,Domaine Faiveley Mercurey Blanc 2016
4431,Schloss Gobelsburg Riesling Zobing 2016
4432,Schloss Gobelsburg Steinsetz Gruner Veltliner 2017
4433,Joseph Drouhin Rully Blanc 2017
4434,Burrier Chateau de Beauregard Pouilly-Fuisse 2016
4435,Camigliano Rosso di Montalcino 2017
4437,Tua Rita Rosso dei Notri 2017
4438,Castellani Collezione Collesano Sangiovese 2014
4439,Holm Oak Tasmania Pinot Noir 2017
4440,Chateau Haut-Batailley (Futures Pre-Sale) 2018
4441,Chateau de Vaudieu Chateauneuf-du-Pape Blanc 2017
4442,Manos Negras Pinot Noir 2015
4443,Chateau Haut-Batailley (Futures Pre-Sale) 2017
4444,Pierre Sparr Schoenenbourg Grand Cru Riesling 2015
4445,Chateau Souverain Merlot 2016
4446,Luce Della Vite Lucente 2016
4447,Tenuta di Ghizzano Veneroso 2015
4448,Tua Rita Perlato del Bosco 2015
4449,Domenico Clerico Barolo Ciabot Mentin 2012
4450,Pikes Riesling Traditionale 2017
4451,Matchbook Syrah 2013
4452,A to Z Rose 2017
4453,Wirra Wirra RSW Shiraz 2014
4454,Terlano Vorberg Riserva Pinot Bianco 2016
4455,Andrew Will Winery Sorella 2014
4456,Quinta do Noval Vintage Port 2016
4457,Trefethen Cabernet Sauvignon 2016
4458,Lagier Meredith Malbec 2016
4459,Big Basin Old Corral Syrah 2012
4460,Tyler Winery Dierberg Vineyard Block 5 Pinot Noir 2016
4461,Samsara Rancho La Vina Pinot Noir 2012
4462,Merry Edwards Flax Vineyard Pinot Noir 2014
4463,The Pinot Project Pinot Noir 2017
4464,Domaine Sarrazin Maranges 2016
4465,Domaine Thibault Liger-Belair Moulin-a-Vent Les Rouchaux 2013
4466,Chateau de la Chaize Vieilles Vignes 2013
4467,Chanson Pere & Fils Marsannay 2015
4468,Louis Jadot Nuits-Saint-Georges 2015
4469,Domaine Olivier Hillaire Chateauneuf-du-Pape Les Terrasses 2015
4470,Cheurlin Rose de Saignee
4471,Dominus Estate 2002
4472,Chateau du Moulin a Vent Croix des Verillats 2015
4473,Bastianich Vigne Orsone Sauvignon 2017
4474,Vignobles Brunier Piedlong Chateauneuf-du-Pape 2015
4475,Hermanos Pecina Cosecha Blanco 2017
4476,Albert Bichot Santenay Clos Rousseau Premier Cru 2016
4477,Von Winning Winnings Riesling 2017
4478,Arnaldo Caprai Grecante Grechetto 2017
4479,Anima Negra Quibia 2017
4480,Lagar de Cervera Albarino Rias Baixas 2018
4481,Penner-Ash Willamette Valley Pinot Noir 2016
4482,Heritiers du Comte Lafon Macon-Milly Lamartine 2017
4483,Geyser Peak Water Bend Chardonnay 2015
4484,Domaine des Billards Saint-Amour 2017
4485,Chateau d'Arcins 2014
4486,The Hilt Vanguard Chardonnay 2015
4487,Pahlmeyer Napa Valley Proprietary Red 2015
4488,Sleight Of Hand The Magician Evergreen Vineyard Riesling 2016
4489,Mt. Beautiful Pinot Gris 2015
4490,Soter Vineyards Planet Oregon Pinot Noir 2017
4491,Panther Creek Winemaker's Cuvee Pinot Noir 2016
4492,Tramin Nussbaumer Gewurztraminer 2016
4493,Smith Woodhouse Late Bottled Vintage Port 2004
4494,Morlet Ma Douce Chardonnay 2015
4495,Goldschmidt Vineyard Yoeman Cabernet Sauvignon 2014
4496,Columbia Winery Red Blend 2016
4497,Waterbrook Reserve Merlot 2015
4498,Chateau Coutet 2010
4499,Domaine du Vieux Telegraphe Chateauneuf-du-Pape Blanc La Crau 2016
4500,Pommery Brut Rose
4501,Louis Pommery Brut California
4502,Illumination Sauvignon Blanc 2017
4503,Ridge Estate Chardonnay 2016
4504,Hermanos Pecina Reserva 2011
4505,Castagnoli Chianti Classico 2013
4506,Viberti Bricco Airoli Barbera d'Alba Superiore 2013
4507,Livio Felluga Friulano 2017
4508,Planeta Etna Bianco 2017
4509,Terrabianca Chianti Classico Scassino 2011
4510,Buglioni l’Imperfetto Valpolicella Classico Superiore 2014
4511,Unico Zelo Cherry Fields Dolcetto 2016
4512,Spy Valley Pinot Noir 2015
4513,Loimer Kamptal Riesling 2014
4514,Mustiguillo Mestizaje 2016
4515,Viberti La Gemella Barbera d'Alba 2017
4516,Bodegas Zerran Tinto 2015
4517,Papapietro Perry Russian River Valley Pinot Noir 2012
4518,Alma Rosa El Jabali Vineyard Chardonnay 2016
4519,Ramey Russian River Pinot Noir 2016
4520,Baileyana Firepeak Chardonnay 2015
4521,Tolosa Winery Estate Chardonnay 2014
4522,Schiavenza Barolo Prapo 2014
4523,Ca'Viola Bric du Luv Barbera d'Alba 2015
4524,Vietti Barbera d'Alba Scarrone 2016
4525,Casarena Owen's Vineyard Cabernet Sauvignon 2014
4526,Fetzer Sundial Chardonnay 2017
4527,Scharffenberger Brut Excellence
4528,Agricola Punica Montessu Isola dei Nuraghi 2016
4529,Domenico Clerico Barolo Aeroplan Servaj 2013
4530,Livio Sassetti Brunello di Montalcino Pertimali Riserva 2012
4531,Carlisle DuPratt Vineyard Zinfandel 2016
4532,Lillian Cabernet Sauvignon
4533,Ghostwriter Woodruff Family Vineyard Pinot Noir 2013
4534,Rubissow Cabernet Sauvignon 2009
4535,Scholium Project The Prince In His Caves Sauvignon Blanc 2017
4536,Hyland Estates Estate Pinot Noir 2015
4537,Tangent Edna Valley Albarino 2017
4538,Abacela Albarino 2016
4539,Mauritson Rockpile Jack's Cabin Vineyard Zinfandel 2014
4540,Klinker Brick Brickmason Red Blend 2016
4541,Concha y Toro Gran Reserva Serie Riberas Cabernet Sauvignon 2017
4542,Brander Cuvee Natalie 2016
4543,Bernardus Griva Vineyard Arroyo Seco Sauvignon Blanc 2014
4544,Black Sheep Finds Amy and Peter Made This Pinot Noir 2014
4545,Donati Family Vineyards Ezio 2015
4546,Fog Monster Chenin Blanc 2013
4547,Morgante Nero d'Avola 2016
4548,Ghostwriter Belle Farms Pinot Noir 2014
4549,La Valentina Montepulciano d'Abruzzo 2015
4550,Clos Pegase Mitsuko's Vineyard Chardonnay 2017
4551,Mettler Family Vineyards Epicenter Old Vine Zinfandel 2015
4552,Waterstone Carneros Pinot Noir 2016
4553,Wing Canyon Lolita Merlot 2013
4554,RouteStock Route 121 Carneros Chardonnay 2018
4555,Mettler Family Vineyards Petite Sirah 2015
4556,Librandi Duca San Felice Ciro Rosso Gaglioppo Riserva 2014
4557,Infamous Goose Sauvignon Blanc 2018
4558,Folonari Montepulciano d'Abruzzo 2017
4559,Arzuaga La Planta 2017
4560,Matthew Fritz Pinot Noir 2016
4561,Vall Llach Embruix 2016
4563,Dr. Thanisch Estate Riesling QbA 2012
4564,"Folk Machine Gas, Food, & Lodging Pinot Noir 2017"
4565,Sarah's Vineyard Madonne Blanc 2015
4566,J. Lohr Fog's Reach Pinot Noir 2016
4567,Ladera Sagrada Castelo do Papa Godello 2017
4568,Foley Johnson Estate Rutherford Meritage 2015
4569,Stuhlmuller Vineyards Alexander Valley Cabernet Sauvignon 2015
4570,Truchard Estate Roussanne 2017
4571,CVNE Rioja Reserva 2014
4572,POE Manchester Ridge Pinot Noir 2015
4573,Fire Road Pinot Noir 2016
4574,Ciro Picariello Fiano di Avellino 2016
4575,Joao Portugal Ramos Vinho Verde Rose 2017
4576,Swanson Pinot Grigio 2017
4577,Felsina Chianti Classico Colonia Gran Selezione 2011
4578,Von Strasser Reserve Cabernet Sauvignon 2013
4579,Cantina Gabriele Dolcemente 2017
4580,Matteo Correggia Roero Arneis 2017
4581,Sbragia Home Ranch Chardonnay 2017
4582,Truchard Estate Chardonnay 2017
4583,Mt. Beautiful Sauvignon Blanc 2018
4584,Ancient Peaks Paso Robles Sauvignon Blanc 2017
4585,Saintsbury Sundawg Ridge Vineyard Pinot Noir 2016
4586,Miner Family Garys' Vineyard Pinot Noir 2016
4587,Tinga Reserve Cabernet Sauvignon 2013
4588,POE Ferrington Vineyard Chardonnay 2015
4589,Truchard Estate Chardonnay 2016
4590,Martin Woods Gamay 2017
4591,Folk Machine Antle Vineyard Pinot Noir 2014
4592,Covenant Red C Rose 2018
4593,Truchard Estate Cabernet Sauvignon 2015
4594,Weingut Gunther Steinmetz Brauenberger Juffer Kabinett Riesling 2016
4595,Niepoort Docil Vinho Verde 2018
4596,Meadowcroft Bonneau Vineyard Chardonnay 2016
4597,Mazzei Chianti Classico Riserva Ser Lapo 2014
4598,Mauritson Sauvignon Blanc 2017
4599,Folk Machine A Night in This Town Pinot Noir 2014
4600,Boekenhoutskloof The Wolftrap 2017
4601,Bodegas Raul Perez Tierra de Leon Blanco 2013
4602,Schug Carneros Pinot Noir 2017
4603,Taft Street Alexander Valley Merlot 2017
4604,Domaine de Montille Beaune Les Greves Premier Cru 2014
4605,Tinga Red Blend Claret 2013
4606,Altesino Montosoli Brunello di Montalcino 2014
4607,POE Van der Kamp Pinot Noir 2015
4608,Bargetto Santa Cruz Mountains Chardonnay 2017
4609,Andre Brunel Cotes du Rhone 2016
4610,Klinker Brick Albarino 2018
4611,Tangent Paragon Vineyard Pinot Gris 2015
4612,Saint Cosme Little James Basket Press Blanc 2017
4613,The Counselor River Pass Vineyard Cabernet Sauvignon 2016
4614,Von Strasser Sori Bricco Vineyard Red 2012
4615,Folk Machine Clarksburg Merritt Island Chenin Blanc 2018
4616,QTR Cabernet Sauvignon 2011
4617,The Withers Grenache 2016
4618,Bressler Vineyards Young Vines Red Wine 2014
4619,BonAnno Pinot Noir 2014
4620,Lagoon Hill Marlborough Pinot Gris 2016
4621,Sojourn Gap's Crown Vineyard Pinot Noir 2016
4622,L'Ecole 41 Estate Merlot 2014
4623,Dashe Dry Creek Zinfandel 2015
4624,"Folk Machine Batten Down The Hatches, The Storm Is Coming Pinot Noir 2016"
4625,Tinga Reserve Merlot 2012
4626,Hobo Wine Company Rockpile Branham Vineyard Zinfandel 2012
4627,The Terraces Rutherford Cabernet Sauvignon 2015
4628,Ancient Peaks Chardonnay 2016
4629,Louis Bernard Cotes du Rhone 2017
4630,Poseidon Vineyard Estate Pinot Noir 2017
4631,Fess Parker Sta. Rita Hills Pinot Noir 2017
4632,Menade Nosso Verdejo 2017
4633,Bodegas Valderiz Valdehermoso Roble 2014
4634,Delectus French Wedding Cabernet Sauvignon 2014
4635,Rene Bouvier Marsannay En Ouzeloy 2014
4636,Douloufakis Dafnios Red 2016
4637,McIntyre Santa Lucia Highlands Chardonnay 2017
4638,Michele Chiarlo Le Marne Gavi 2017
4639,Orogeny Vineyards Green Valley Pinot Noir 2016
4640,Isabel Mondavi Chardonnay Napa Valley 2016
4641,Sky Mt. Veeder Zinfandel 2013
4642,Fess Parker The Big Easy 2017
4643,Tangent Paragon Vineyard Sauvignon Blanc 2015
4644,Dr. Hermann Urziger Wurzgarten Kabinett Riesling 2017
4645,Goldschmidt Vineyard Game Ranch Cabernet Sauvignon 2015
4646,Pindar Cabernet Franc 2014
4647,Hook and Ladder Los Amigos Ranch Estate Cabernet Sauvignon 2014
4648,Paul Achs Lust and Leben 2016
4649,Paul Achs Edelgrund Blaufrankisch 2015
4650,Meadowcroft Los Carneros Chardonnay 2017
4651,Foris Gewurztraminer 2017
4652,Casa E. di Mirafiore Barbera d'Alba Superiore 2013
4653,Vino de Eyzaguirre Reserve Especial Syrah 2016
4654,Obsidian Ridge Half Mile 2016
4655,Liquid Farm Vogelzang Vineyard Rose 2018
4656,The Withers Ruben GSM 2015
4657,Brander Cuvee Natalie 2014
4658,Ferdinand Tempranillo 2015
4659,Lucienne Lone Oak Vineyard Pinot Noir 2017
4660,Maison Montille Montagny Les Coeres Premier Cru 2013
4661,Matthiasson Rose 2018
4663,Klinker Brick Cabernet Sauvignon 2015
4664,Au Contraire Lawler Vineyard Pinot Noir 2013
4665,The Paring Pinot Noir 2015
4666,Steele Carneros Pinot Noir 2014
4667,Kinsella Estates Jersey Boys Vineyard Cabernet Sauvignon 2012
4668,Robert Craig Cellars Gap's Crown Vineyard Chardonnay 2013
4669,WillaKenzie Estate Pinot Gris 2017
4670,Jean-Charles Fagot St-Aubin Premier Cru 2015
4671,Iron Horse Estate Chardonnay 2015
4672,Terra d'Oro Pinot Grigio 2017
4673,Oliverhill Red Silk Shiraz 2016
4674,Broadley Shea Pinot Noir 2013
4675,Silver Thread STV Estate Vineyard Gewurztraminer 2017
4676,Adobe Road Rutherford Cabernet Sauvignon 2012
4677,J.J. Vincent Pouilly-Fuisse Marie Antoinette 2016
4678,Skouras Zoe Red 2017
4679,Sottimano Dolcetto d'Alba Bric del Salto 2017
4680,Broglia Bruno Broglia Gavi di Gavi 2016
4681,Tablelands Pinot Noir 2016
4682,Louis Latour Macon-Villages Chameroy 2017
4683,Lafond SRH Series Chardonnay 2016
4684,Birichino Boer Vineyard Pinot Noir 2016
4685,Darms Lane Bon Passe Vineyard Cabernet Sauvignon 2012
4686,Purple Hands Shea Vineyard Pinot Noir 2017
4687,Birichino Jurassic Park Vineyard Old Vines Chenin Blanc 2016
4688,Ransom Albarino 2016
4689,Tormentoso Mourvedre 2015
4690,Schloss Gobelsburg Tradition Gruner Veltliner 2015
4691,Roth Heritage Red 2015
4692,Rex Hill Jacob Hart Vineyard Pinot Noir 2016
4693,Heritiers du Comte Lafon Macon-Milly Lamartine Clos du Four 2016
4694,K Vintners Charlotte 2015
4695,Brick House Evelyn's Pinot Noir 2015
4696,De Toren Fusion V 2016
4697,Vitkin Winery Journey White 2016
4698,Turnbull Black Label Cabernet Sauvignon 2016
4699,High Dive Napa Valley Red Blend 2014
4700,Moobuzz Grenache Syrah Mourvedre 2015
4701,Elderton Command Shiraz 2014
4702,Doubleback Cabernet Sauvignon 2015
4703,Sojourn Sonoma Coast Pinot Noir 2016
4704,Escarlata 2014
4705,Henry Fessy Beaujolais-Villages Vieilles Vignes 2017
4706,Elk Cove Five Mountain Pinot Noir 2016
4707,Marques de Murrieta Capellania White Reserva 2014
4708,Michel Redde Pouilly Fume La Moynerie 2016
4709,Omen Zinfandel 2015
4710,Swanson Napa Valley Merlot 2016
4711,Framingham Nobody's Hero Sauvignon Blanc 2017
4712,Sandhi Sta. Rita Hills Chardonnay 2015
4713,Domaine Pinson Freres Chablis La Foret Premier Cru 2016
4714,ONX Wine Mad Crush 2014
4715,Gamble Family Vineyards Napa Valley Cabernet Sauvignon 2014
4716,Galardi Roccamonfina Terra di Lavoro 2007
4717,BenMarco Expresivo 2015
4718,Ochota Barrels The Green Room Grenache Noir Syrah 2017
4719,Chateau La Nerthe Chateauneuf-du-Pape Rouge 2015
4720,Jaffelin Savigny-les-Beaune Les Vergelesses Premier Cru 2015
4721,Chateau de Nalys Saintes Pierres de Nalys Chateauneuf-du-Pape 2016
4722,Mayacamas The Terraces Chardonnay 2013
4723,Failla Hirsch Vineyard Pinot Noir 2016
4724,Il Palagio When We Dance Chianti 2017
4725,Fonseca Late Bottled Vintage 2012
4726,Saintsbury Pratt Vineyard Pinot Noir 2016
4727,Chateau de Camensac 2015
4728,Jezreel Winery Single Vineyard Carignan 2014
4729,Chateau La Confession 2011
4730,Chateau Meyney 2014
4731,Penfolds Max's Cabernet Sauvignon 2016
4732,Jonata El Alma de Jonata 2011
4733,Leeuwin Estate Prelude Vineyards Chardonnay 2016
4734,Tua Rita Giusto di Notri 2016
4735,Fantinel Prosecco
4736,Quady Essensia Orange Muscat 2016
4737,Jax Vineyards Y3 Pinot Noir 2016
4738,Bodegas Nieto Senetiner Don Nicanor Single Vineyard Malbec 2014
4739,DeLoach Estate Chardonnay 2013
4740,Lewis Cellars Sonoma Chardonnay 2016
4741,Hook and Ladder The Tillerman Red Blend 2015
4742,Porter-Bass Chardonnay 2014
4743,Benovia Martaella Vineyard Pinot Noir 2012
4744,Taft Street Russian River Valley Chardonnay 2015
4745,Revolution Wine Company El Libre Cabernet Sauvignon 2017
4746,Gary Farrell Russian River Chardonnay 2017
4747,Mont Gravet Cotes de Gascogne 2017
4748,Eric Kent Stiling Vineyard Pinot Noir 2015
4749,Benziger Organic Reserve Pinot Noir 2016
4750,L10 by Valentin Bianchi Malbec 2016
4751,Roth Russian River Valley Sauvignon Blanc 2017
4752,Hartford Rose of Pinot Noir 2016
4753,Capiaux Cellars Widdoes Vineyard Pinot Noir 2016
4754,Carletto Prosecco
4755,Row Eleven Russian River Pinot Noir 2016
4756,Taft Street Russian River Valley Pinot Noir 2016
4757,Zepaltas Russian River Chardonnay 2014
4758,Marimar Estate Don Miguel Vineyard Acero Chardonnay 2017
4759,Pulenta Estate Sauvignon Blanc 2018
4760,Neyers Placida Vineyard Pinot Noir 2013
4761,Elk Cove Pinot Blanc 2015
